<?xml version="1.0" encoding="utf-8"?>
<?xml-stylesheet type="text/xsl" href="pdml2html.xsl"?>
<!-- You can find pdml2html.xsl in /usr/share/wireshark or at https://code.wireshark.org/review/gitweb?p=wireshark.git;a=blob_plain;f=pdml2html.xsl. -->
<pdml version="0" creator="wireshark/3.2.3" time="Wed May 24 21:25:07 2023" capture_file="/home/lily/5G/PCAPS/Core/syn_ack.pcapng">
<packet>
  <proto name="geninfo" pos="0" showname="General information" size="74">
    <field name="num" pos="0" show="1" showname="Number" value="1" size="74"/>
    <field name="len" pos="0" show="74" showname="Frame Length" value="4a" size="74"/>
    <field name="caplen" pos="0" show="74" showname="Captured Length" value="4a" size="74"/>
    <field name="timestamp" pos="0" show="May 24, 2023 20:26:18.110763717 CEST" showname="Captured Time" value="1684952778.110763717" size="74"/>
  </proto>
  <proto name="frame" showname="Frame 1: 74 bytes on wire (592 bits), 74 bytes captured (592 bits) on interface veth_nssf, id 0" size="74" pos="0">
    <field name="filtered" value="frame" />
  </proto>
  <proto name="eth" showname="Ethernet II, Src: da:73:09:fb:97:ae, Dst: 7a:24:b4:3d:64:76" size="14" pos="0">
    <field name="filtered" value="eth" />
  </proto>
  <proto name="ip" showname="Internet Protocol Version 4, Src: 10.0.6.1, Dst: 10.0.9.1" size="20" pos="14">
    <field name="filtered" value="ip" />
  </proto>
  <proto name="tcp" showname="Transmission Control Protocol, Src Port: 40740, Dst Port: 7777, Seq: 4090257148, Len: 0" size="40" pos="34">
    <field name="tcp.srcport" showname="Source Port: 40740" size="2" pos="34" show="40740" value="9f24"/>
    <field name="tcp.dstport" showname="Destination Port: 7777" size="2" pos="36" show="7777" value="1e61"/>
    <field name="tcp.port" showname="Source or Destination Port: 40740" hide="yes" size="2" pos="34" show="40740" value="9f24"/>
    <field name="tcp.port" showname="Source or Destination Port: 7777" hide="yes" size="2" pos="36" show="7777" value="1e61"/>
    <field name="tcp.stream" showname="Stream index: 0" size="0" pos="34" show="0"/>
    <field name="tcp.len" showname="TCP Segment Len: 0" size="1" pos="46" show="0" value="a0"/>
    <field name="tcp.seq" showname="Sequence number: 4090257148" size="4" pos="38" show="4090257148" value="f3cc5efc"/>
    <field name="tcp.seq_raw" showname="Sequence number (raw): 4090257148" hide="yes" size="4" pos="38" show="4090257148" value="f3cc5efc"/>
    <field name="tcp.nxtseq" showname="Next sequence number: 4090257149" size="0" pos="34" show="4090257149"/>
    <field name="tcp.ack" showname="Acknowledgment number: 0" size="4" pos="42" show="0" value="00000000"/>
    <field name="tcp.ack_raw" showname="Acknowledgment number (raw): 0" size="4" pos="42" show="0" value="00000000"/>
    <field name="tcp.hdr_len" showname="1010 .... = Header Length: 40 bytes (10)" size="1" pos="46" show="40" value="a0"/>
    <field name="tcp.flags" showname="Flags: 0x002 (SYN)" size="2" pos="46" show="0x00000002" value="2" unmaskedvalue="a002">
      <field name="tcp.flags.res" showname="000. .... .... = Reserved: Not set" size="1" pos="46" show="0" value="0" unmaskedvalue="a0"/>
      <field name="tcp.flags.ns" showname="...0 .... .... = Nonce: Not set" size="1" pos="46" show="0" value="0" unmaskedvalue="a0"/>
      <field name="tcp.flags.cwr" showname=".... 0... .... = Congestion Window Reduced (CWR): Not set" size="1" pos="47" show="0" value="0" unmaskedvalue="02"/>
      <field name="tcp.flags.ecn" showname=".... .0.. .... = ECN-Echo: Not set" size="1" pos="47" show="0" value="0" unmaskedvalue="02"/>
      <field name="tcp.flags.urg" showname=".... ..0. .... = Urgent: Not set" size="1" pos="47" show="0" value="0" unmaskedvalue="02"/>
      <field name="tcp.flags.ack" showname=".... ...0 .... = Acknowledgment: Not set" size="1" pos="47" show="0" value="0" unmaskedvalue="02"/>
      <field name="tcp.flags.push" showname=".... .... 0... = Push: Not set" size="1" pos="47" show="0" value="0" unmaskedvalue="02"/>
      <field name="tcp.flags.reset" showname=".... .... .0.. = Reset: Not set" size="1" pos="47" show="0" value="0" unmaskedvalue="02"/>
      <field name="tcp.flags.syn" showname=".... .... ..1. = Syn: Set" size="1" pos="47" show="1" value="1" unmaskedvalue="02">
        <field name="_ws.expert" showname="Expert Info (Chat/Sequence): Connection establish request (SYN): server port 7777" size="0" pos="47">
          <field name="tcp.connection.syn" showname="Connection establish request (SYN): server port 7777" size="0" pos="0" show="" value=""/>
          <field name="_ws.expert.message" showname="Message: Connection establish request (SYN): server port 7777" hide="yes" size="0" pos="0" show="Connection establish request (SYN): server port 7777"/>
          <field name="_ws.expert.severity" showname="Severity level: Chat" size="0" pos="0" show="2097152"/>
          <field name="_ws.expert.group" showname="Group: Sequence" size="0" pos="0" show="33554432"/>
        </field>
      </field>
      <field name="tcp.flags.fin" showname=".... .... ...0 = Fin: Not set" size="1" pos="47" show="0" value="0" unmaskedvalue="02"/>
      <field name="tcp.flags.str" showname="TCP Flags: \xc2\xb7\xc2\xb7\xc2\xb7\xc2\xb7\xc2\xb7\xc2\xb7\xc2\xb7\xc2\xb7\xc2\xb7\xc2\xb7S\xc2\xb7" size="2" pos="46" show="\xc2\xb7\xc2\xb7\xc2\xb7\xc2\xb7\xc2\xb7\xc2\xb7\xc2\xb7\xc2\xb7\xc2\xb7\xc2\xb7S\xc2\xb7" value="a002"/>
    </field>
    <field name="tcp.window_size_value" showname="Window size value: 64240" size="2" pos="48" show="64240" value="faf0"/>
    <field name="tcp.window_size" showname="Calculated window size: 64240" size="2" pos="48" show="64240" value="faf0"/>
    <field name="tcp.checksum" showname="Checksum: 0x2330 [unverified]" size="2" pos="50" show="0x00002330" value="2330"/>
    <field name="tcp.checksum.status" showname="Checksum Status: Unverified" size="0" pos="50" show="2"/>
    <field name="tcp.urgent_pointer" showname="Urgent pointer: 0" size="2" pos="52" show="0" value="0000"/>
    <field name="tcp.options" showname="Options: (20 bytes), Maximum segment size, SACK permitted, Timestamps, No-Operation (NOP), Window scale" size="20" pos="54" show="02:04:05:b4:04:02:08:0a:19:75:fd:77:00:00:00:00:01:03:03:07" value="020405b40402080a1975fd770000000001030307">
      <field name="tcp.options.mss" showname="TCP Option - Maximum segment size: 1460 bytes" size="4" pos="54" show="02:04:05:b4" value="020405b4">
        <field name="tcp.option_kind" showname="Kind: Maximum Segment Size (2)" size="1" pos="54" show="2" value="02"/>
        <field name="tcp.option_len" showname="Length: 4" size="1" pos="55" show="4" value="04"/>
        <field name="tcp.options.mss_val" showname="MSS Value: 1460" size="2" pos="56" show="1460" value="05b4"/>
      </field>
      <field name="tcp.options.sack_perm" showname="TCP Option - SACK permitted" size="2" pos="58" show="04:02" value="0402">
        <field name="tcp.option_kind" showname="Kind: SACK Permitted (4)" size="1" pos="58" show="4" value="04"/>
        <field name="tcp.option_len" showname="Length: 2" size="1" pos="59" show="2" value="02"/>
      </field>
      <field name="tcp.options.timestamp" showname="TCP Option - Timestamps: TSval 427162999, TSecr 0" size="10" pos="60" show="08:0a:19:75:fd:77:00:00:00:00" value="080a1975fd7700000000">
        <field name="tcp.option_kind" showname="Kind: Time Stamp Option (8)" size="1" pos="60" show="8" value="08"/>
        <field name="tcp.option_len" showname="Length: 10" size="1" pos="61" show="10" value="0a"/>
        <field name="tcp.options.timestamp.tsval" showname="Timestamp value: 427162999" size="4" pos="62" show="427162999" value="1975fd77"/>
        <field name="tcp.options.timestamp.tsecr" showname="Timestamp echo reply: 0" size="4" pos="66" show="0" value="00000000"/>
      </field>
      <field name="tcp.options.nop" showname="TCP Option - No-Operation (NOP)" size="1" pos="70" show="01" value="01">
        <field name="tcp.option_kind" showname="Kind: No-Operation (1)" size="1" pos="70" show="1" value="01"/>
      </field>
      <field name="tcp.options.wscale" showname="TCP Option - Window scale: 7 (multiply by 128)" size="3" pos="71" show="03:03:07" value="030307">
        <field name="tcp.option_kind" showname="Kind: Window Scale (3)" size="1" pos="71" show="3" value="03"/>
        <field name="tcp.option_len" showname="Length: 3" size="1" pos="72" show="3" value="03"/>
        <field name="tcp.options.wscale.shift" showname="Shift count: 7" size="1" pos="73" show="7" value="07"/>
        <field name="tcp.options.wscale.multiplier" showname="Multiplier: 128" size="1" pos="73" show="128" value="07"/>
      </field>
    </field>
    <field name="" show="Timestamps" size="0" pos="34">
      <field name="tcp.time_relative" showname="Time since first frame in this TCP stream: 0.000000000 seconds" size="0" pos="34" show="0.000000000"/>
      <field name="tcp.time_delta" showname="Time since previous frame in this TCP stream: 0.000000000 seconds" size="0" pos="34" show="0.000000000"/>
    </field>
  </proto>
</packet>


<packet>
  <proto name="geninfo" pos="0" showname="General information" size="74">
    <field name="num" pos="0" show="2" showname="Number" value="2" size="74"/>
    <field name="len" pos="0" show="74" showname="Frame Length" value="4a" size="74"/>
    <field name="caplen" pos="0" show="74" showname="Captured Length" value="4a" size="74"/>
    <field name="timestamp" pos="0" show="May 24, 2023 20:26:18.110780540 CEST" showname="Captured Time" value="1684952778.110780540" size="74"/>
  </proto>
  <proto name="frame" showname="Frame 2: 74 bytes on wire (592 bits), 74 bytes captured (592 bits) on interface veth_nssf, id 0" size="74" pos="0">
    <field name="filtered" value="frame" />
  </proto>
  <proto name="eth" showname="Ethernet II, Src: 7a:24:b4:3d:64:76, Dst: da:73:09:fb:97:ae" size="14" pos="0">
    <field name="filtered" value="eth" />
  </proto>
  <proto name="ip" showname="Internet Protocol Version 4, Src: 10.0.9.1, Dst: 10.0.6.1" size="20" pos="14">
    <field name="filtered" value="ip" />
  </proto>
  <proto name="tcp" showname="Transmission Control Protocol, Src Port: 7777, Dst Port: 40740, Seq: 3590916936, Ack: 4090257149, Len: 0" size="40" pos="34">
    <field name="tcp.srcport" showname="Source Port: 7777" size="2" pos="34" show="7777" value="1e61"/>
    <field name="tcp.dstport" showname="Destination Port: 40740" size="2" pos="36" show="40740" value="9f24"/>
    <field name="tcp.port" showname="Source or Destination Port: 7777" hide="yes" size="2" pos="34" show="7777" value="1e61"/>
    <field name="tcp.port" showname="Source or Destination Port: 40740" hide="yes" size="2" pos="36" show="40740" value="9f24"/>
    <field name="tcp.stream" showname="Stream index: 0" size="0" pos="34" show="0"/>
    <field name="tcp.len" showname="TCP Segment Len: 0" size="1" pos="46" show="0" value="a0"/>
    <field name="tcp.seq" showname="Sequence number: 3590916936" size="4" pos="38" show="3590916936" value="d6090b48"/>
    <field name="tcp.seq_raw" showname="Sequence number (raw): 3590916936" hide="yes" size="4" pos="38" show="3590916936" value="d6090b48"/>
    <field name="tcp.nxtseq" showname="Next sequence number: 3590916937" size="0" pos="34" show="3590916937"/>
    <field name="tcp.ack" showname="Acknowledgment number: 4090257149" size="4" pos="42" show="4090257149" value="f3cc5efd"/>
    <field name="tcp.ack_raw" showname="Acknowledgment number (raw): 4090257149" hide="yes" size="4" pos="42" show="4090257149" value="f3cc5efd"/>
    <field name="tcp.hdr_len" showname="1010 .... = Header Length: 40 bytes (10)" size="1" pos="46" show="40" value="a0"/>
    <field name="tcp.flags" showname="Flags: 0x012 (SYN, ACK)" size="2" pos="46" show="0x00000012" value="12" unmaskedvalue="a012">
      <field name="tcp.flags.res" showname="000. .... .... = Reserved: Not set" size="1" pos="46" show="0" value="0" unmaskedvalue="a0"/>
      <field name="tcp.flags.ns" showname="...0 .... .... = Nonce: Not set" size="1" pos="46" show="0" value="0" unmaskedvalue="a0"/>
      <field name="tcp.flags.cwr" showname=".... 0... .... = Congestion Window Reduced (CWR): Not set" size="1" pos="47" show="0" value="0" unmaskedvalue="12"/>
      <field name="tcp.flags.ecn" showname=".... .0.. .... = ECN-Echo: Not set" size="1" pos="47" show="0" value="0" unmaskedvalue="12"/>
      <field name="tcp.flags.urg" showname=".... ..0. .... = Urgent: Not set" size="1" pos="47" show="0" value="0" unmaskedvalue="12"/>
      <field name="tcp.flags.ack" showname=".... ...1 .... = Acknowledgment: Set" size="1" pos="47" show="1" value="1" unmaskedvalue="12"/>
      <field name="tcp.flags.push" showname=".... .... 0... = Push: Not set" size="1" pos="47" show="0" value="0" unmaskedvalue="12"/>
      <field name="tcp.flags.reset" showname=".... .... .0.. = Reset: Not set" size="1" pos="47" show="0" value="0" unmaskedvalue="12"/>
      <field name="tcp.flags.syn" showname=".... .... ..1. = Syn: Set" size="1" pos="47" show="1" value="1" unmaskedvalue="12">
        <field name="_ws.expert" showname="Expert Info (Chat/Sequence): Connection establish acknowledge (SYN+ACK): server port 7777" size="0" pos="47">
          <field name="tcp.connection.sack" showname="Connection establish acknowledge (SYN+ACK): server port 7777" size="0" pos="0" show="" value=""/>
          <field name="_ws.expert.message" showname="Message: Connection establish acknowledge (SYN+ACK): server port 7777" hide="yes" size="0" pos="0" show="Connection establish acknowledge (SYN+ACK): server port 7777"/>
          <field name="_ws.expert.severity" showname="Severity level: Chat" size="0" pos="0" show="2097152"/>
          <field name="_ws.expert.group" showname="Group: Sequence" size="0" pos="0" show="33554432"/>
        </field>
      </field>
      <field name="tcp.flags.fin" showname=".... .... ...0 = Fin: Not set" size="1" pos="47" show="0" value="0" unmaskedvalue="12"/>
      <field name="tcp.flags.str" showname="TCP Flags: \xc2\xb7\xc2\xb7\xc2\xb7\xc2\xb7\xc2\xb7\xc2\xb7\xc2\xb7A\xc2\xb7\xc2\xb7S\xc2\xb7" size="2" pos="46" show="\xc2\xb7\xc2\xb7\xc2\xb7\xc2\xb7\xc2\xb7\xc2\xb7\xc2\xb7A\xc2\xb7\xc2\xb7S\xc2\xb7" value="a012"/>
    </field>
    <field name="tcp.window_size_value" showname="Window size value: 65160" size="2" pos="48" show="65160" value="fe88"/>
    <field name="tcp.window_size" showname="Calculated window size: 65160" size="2" pos="48" show="65160" value="fe88"/>
    <field name="tcp.checksum" showname="Checksum: 0x2330 [unverified]" size="2" pos="50" show="0x00002330" value="2330"/>
    <field name="tcp.checksum.status" showname="Checksum Status: Unverified" size="0" pos="50" show="2"/>
    <field name="tcp.urgent_pointer" showname="Urgent pointer: 0" size="2" pos="52" show="0" value="0000"/>
    <field name="tcp.options" showname="Options: (20 bytes), Maximum segment size, SACK permitted, Timestamps, No-Operation (NOP), Window scale" size="20" pos="54" show="02:04:05:b4:04:02:08:0a:ef:cd:95:b8:19:75:fd:77:01:03:03:07" value="020405b40402080aefcd95b81975fd7701030307">
      <field name="tcp.options.mss" showname="TCP Option - Maximum segment size: 1460 bytes" size="4" pos="54" show="02:04:05:b4" value="020405b4">
        <field name="tcp.option_kind" showname="Kind: Maximum Segment Size (2)" size="1" pos="54" show="2" value="02"/>
        <field name="tcp.option_len" showname="Length: 4" size="1" pos="55" show="4" value="04"/>
        <field name="tcp.options.mss_val" showname="MSS Value: 1460" size="2" pos="56" show="1460" value="05b4"/>
      </field>
      <field name="tcp.options.sack_perm" showname="TCP Option - SACK permitted" size="2" pos="58" show="04:02" value="0402">
        <field name="tcp.option_kind" showname="Kind: SACK Permitted (4)" size="1" pos="58" show="4" value="04"/>
        <field name="tcp.option_len" showname="Length: 2" size="1" pos="59" show="2" value="02"/>
      </field>
      <field name="tcp.options.timestamp" showname="TCP Option - Timestamps: TSval 4023227832, TSecr 427162999" size="10" pos="60" show="08:0a:ef:cd:95:b8:19:75:fd:77" value="080aefcd95b81975fd77">
        <field name="tcp.option_kind" showname="Kind: Time Stamp Option (8)" size="1" pos="60" show="8" value="08"/>
        <field name="tcp.option_len" showname="Length: 10" size="1" pos="61" show="10" value="0a"/>
        <field name="tcp.options.timestamp.tsval" showname="Timestamp value: 4023227832" size="4" pos="62" show="4023227832" value="efcd95b8"/>
        <field name="tcp.options.timestamp.tsecr" showname="Timestamp echo reply: 427162999" size="4" pos="66" show="427162999" value="1975fd77"/>
      </field>
      <field name="tcp.options.nop" showname="TCP Option - No-Operation (NOP)" size="1" pos="70" show="01" value="01">
        <field name="tcp.option_kind" showname="Kind: No-Operation (1)" size="1" pos="70" show="1" value="01"/>
      </field>
      <field name="tcp.options.wscale" showname="TCP Option - Window scale: 7 (multiply by 128)" size="3" pos="71" show="03:03:07" value="030307">
        <field name="tcp.option_kind" showname="Kind: Window Scale (3)" size="1" pos="71" show="3" value="03"/>
        <field name="tcp.option_len" showname="Length: 3" size="1" pos="72" show="3" value="03"/>
        <field name="tcp.options.wscale.shift" showname="Shift count: 7" size="1" pos="73" show="7" value="07"/>
        <field name="tcp.options.wscale.multiplier" showname="Multiplier: 128" size="1" pos="73" show="128" value="07"/>
      </field>
    </field>
    <field name="" show="Timestamps" size="0" pos="34">
      <field name="tcp.time_relative" showname="Time since first frame in this TCP stream: 0.000016823 seconds" size="0" pos="34" show="0.000016823"/>
      <field name="tcp.time_delta" showname="Time since previous frame in this TCP stream: 0.000016823 seconds" size="0" pos="34" show="0.000016823"/>
    </field>
  </proto>
</packet>


<packet>
  <proto name="geninfo" pos="0" showname="General information" size="54">
    <field name="num" pos="0" show="3" showname="Number" value="3" size="54"/>
    <field name="len" pos="0" show="54" showname="Frame Length" value="36" size="54"/>
    <field name="caplen" pos="0" show="54" showname="Captured Length" value="36" size="54"/>
    <field name="timestamp" pos="0" show="May 24, 2023 20:26:18.110797442 CEST" showname="Captured Time" value="1684952778.110797442" size="54"/>
  </proto>
  <proto name="frame" showname="Frame 3: 54 bytes on wire (432 bits), 54 bytes captured (432 bits) on interface veth_nssf, id 0" size="54" pos="0">
    <field name="filtered" value="frame" />
  </proto>
  <proto name="eth" showname="Ethernet II, Src: da:73:09:fb:97:ae, Dst: 7a:24:b4:3d:64:76" size="14" pos="0">
    <field name="filtered" value="eth" />
  </proto>
  <proto name="ip" showname="Internet Protocol Version 4, Src: 10.0.6.1, Dst: 10.0.9.1" size="20" pos="14">
    <field name="filtered" value="ip" />
  </proto>
  <proto name="tcp" showname="Transmission Control Protocol, Src Port: 40740, Dst Port: 7777, Seq: 4090257149, Len: 0" size="20" pos="34">
    <field name="tcp.srcport" showname="Source Port: 40740" size="2" pos="34" show="40740" value="9f24"/>
    <field name="tcp.dstport" showname="Destination Port: 7777" size="2" pos="36" show="7777" value="1e61"/>
    <field name="tcp.port" showname="Source or Destination Port: 40740" hide="yes" size="2" pos="34" show="40740" value="9f24"/>
    <field name="tcp.port" showname="Source or Destination Port: 7777" hide="yes" size="2" pos="36" show="7777" value="1e61"/>
    <field name="tcp.stream" showname="Stream index: 0" size="0" pos="34" show="0"/>
    <field name="tcp.len" showname="TCP Segment Len: 0" size="1" pos="46" show="0" value="50"/>
    <field name="tcp.seq" showname="Sequence number: 4090257149" size="4" pos="38" show="4090257149" value="f3cc5efd"/>
    <field name="tcp.seq_raw" showname="Sequence number (raw): 4090257149" hide="yes" size="4" pos="38" show="4090257149" value="f3cc5efd"/>
    <field name="tcp.nxtseq" showname="Next sequence number: 4090257149" size="0" pos="34" show="4090257149"/>
    <field name="tcp.ack" showname="Acknowledgment number: 0" size="4" pos="42" show="0" value="00000000"/>
    <field name="tcp.ack_raw" showname="Acknowledgment number (raw): 0" size="4" pos="42" show="0" value="00000000"/>
    <field name="tcp.hdr_len" showname="0101 .... = Header Length: 20 bytes (5)" size="1" pos="46" show="20" value="50"/>
    <field name="tcp.flags" showname="Flags: 0x004 (RST)" size="2" pos="46" show="0x00000004" value="4" unmaskedvalue="5004">
      <field name="tcp.flags.res" showname="000. .... .... = Reserved: Not set" size="1" pos="46" show="0" value="0" unmaskedvalue="50"/>
      <field name="tcp.flags.ns" showname="...0 .... .... = Nonce: Not set" size="1" pos="46" show="0" value="0" unmaskedvalue="50"/>
      <field name="tcp.flags.cwr" showname=".... 0... .... = Congestion Window Reduced (CWR): Not set" size="1" pos="47" show="0" value="0" unmaskedvalue="04"/>
      <field name="tcp.flags.ecn" showname=".... .0.. .... = ECN-Echo: Not set" size="1" pos="47" show="0" value="0" unmaskedvalue="04"/>
      <field name="tcp.flags.urg" showname=".... ..0. .... = Urgent: Not set" size="1" pos="47" show="0" value="0" unmaskedvalue="04"/>
      <field name="tcp.flags.ack" showname=".... ...0 .... = Acknowledgment: Not set" size="1" pos="47" show="0" value="0" unmaskedvalue="04"/>
      <field name="tcp.flags.push" showname=".... .... 0... = Push: Not set" size="1" pos="47" show="0" value="0" unmaskedvalue="04"/>
      <field name="tcp.flags.reset" showname=".... .... .1.. = Reset: Set" size="1" pos="47" show="1" value="1" unmaskedvalue="04">
        <field name="_ws.expert" showname="Expert Info (Warning/Sequence): Connection reset (RST)" size="0" pos="47">
          <field name="tcp.connection.rst" showname="Connection reset (RST)" size="0" pos="0" show="" value=""/>
          <field name="_ws.expert.message" showname="Message: Connection reset (RST)" hide="yes" size="0" pos="0" show="Connection reset (RST)"/>
          <field name="_ws.expert.severity" showname="Severity level: Warning" size="0" pos="0" show="6291456"/>
          <field name="_ws.expert.group" showname="Group: Sequence" size="0" pos="0" show="33554432"/>
        </field>
      </field>
      <field name="tcp.flags.syn" showname=".... .... ..0. = Syn: Not set" size="1" pos="47" show="0" value="0" unmaskedvalue="04"/>
      <field name="tcp.flags.fin" showname=".... .... ...0 = Fin: Not set" size="1" pos="47" show="0" value="0" unmaskedvalue="04"/>
      <field name="tcp.flags.str" showname="TCP Flags: \xc2\xb7\xc2\xb7\xc2\xb7\xc2\xb7\xc2\xb7\xc2\xb7\xc2\xb7\xc2\xb7\xc2\xb7R\xc2\xb7\xc2\xb7" size="2" pos="46" show="\xc2\xb7\xc2\xb7\xc2\xb7\xc2\xb7\xc2\xb7\xc2\xb7\xc2\xb7\xc2\xb7\xc2\xb7R\xc2\xb7\xc2\xb7" value="5004"/>
    </field>
    <field name="tcp.window_size_value" showname="Window size value: 0" size="2" pos="48" show="0" value="0000"/>
    <field name="tcp.window_size" showname="Calculated window size: 0" size="2" pos="48" show="0" value="0000"/>
    <field name="tcp.window_size_scalefactor" showname="Window size scaling factor: 128" size="2" pos="48" show="128" value="0000"/>
    <field name="tcp.checksum" showname="Checksum: 0x7c8f [unverified]" size="2" pos="50" show="0x00007c8f" value="7c8f"/>
    <field name="tcp.checksum.status" showname="Checksum Status: Unverified" size="0" pos="50" show="2"/>
    <field name="tcp.urgent_pointer" showname="Urgent pointer: 0" size="2" pos="52" show="0" value="0000"/>
    <field name="" show="Timestamps" size="0" pos="34">
      <field name="tcp.time_relative" showname="Time since first frame in this TCP stream: 0.000033725 seconds" size="0" pos="34" show="0.000033725"/>
      <field name="tcp.time_delta" showname="Time since previous frame in this TCP stream: 0.000016902 seconds" size="0" pos="34" show="0.000016902"/>
    </field>
  </proto>
</packet>


<packet>
  <proto name="geninfo" pos="0" showname="General information" size="74">
    <field name="num" pos="0" show="4" showname="Number" value="4" size="74"/>
    <field name="len" pos="0" show="74" showname="Frame Length" value="4a" size="74"/>
    <field name="caplen" pos="0" show="74" showname="Captured Length" value="4a" size="74"/>
    <field name="timestamp" pos="0" show="May 24, 2023 20:26:19.111576778 CEST" showname="Captured Time" value="1684952779.111576778" size="74"/>
  </proto>
  <proto name="frame" showname="Frame 4: 74 bytes on wire (592 bits), 74 bytes captured (592 bits) on interface veth_nssf, id 0" size="74" pos="0">
    <field name="filtered" value="frame" />
  </proto>
  <proto name="eth" showname="Ethernet II, Src: da:73:09:fb:97:ae, Dst: 7a:24:b4:3d:64:76" size="14" pos="0">
    <field name="filtered" value="eth" />
  </proto>
  <proto name="ip" showname="Internet Protocol Version 4, Src: 10.0.6.1, Dst: 10.0.9.1" size="20" pos="14">
    <field name="filtered" value="ip" />
  </proto>
  <proto name="tcp" showname="Transmission Control Protocol, Src Port: 40740, Dst Port: 7777, Seq: 4090257148, Len: 0" size="40" pos="34">
    <field name="tcp.srcport" showname="Source Port: 40740" size="2" pos="34" show="40740" value="9f24"/>
    <field name="tcp.dstport" showname="Destination Port: 7777" size="2" pos="36" show="7777" value="1e61"/>
    <field name="tcp.port" showname="Source or Destination Port: 40740" hide="yes" size="2" pos="34" show="40740" value="9f24"/>
    <field name="tcp.port" showname="Source or Destination Port: 7777" hide="yes" size="2" pos="36" show="7777" value="1e61"/>
    <field name="tcp.stream" showname="Stream index: 0" size="0" pos="34" show="0"/>
    <field name="tcp.len" showname="TCP Segment Len: 0" size="1" pos="46" show="0" value="a0"/>
    <field name="tcp.seq" showname="Sequence number: 4090257148" size="4" pos="38" show="4090257148" value="f3cc5efc"/>
    <field name="tcp.seq_raw" showname="Sequence number (raw): 4090257148" hide="yes" size="4" pos="38" show="4090257148" value="f3cc5efc"/>
    <field name="tcp.nxtseq" showname="Next sequence number: 4090257149" size="0" pos="34" show="4090257149"/>
    <field name="tcp.ack" showname="Acknowledgment number: 0" size="4" pos="42" show="0" value="00000000"/>
    <field name="tcp.ack_raw" showname="Acknowledgment number (raw): 0" size="4" pos="42" show="0" value="00000000"/>
    <field name="tcp.hdr_len" showname="1010 .... = Header Length: 40 bytes (10)" size="1" pos="46" show="40" value="a0"/>
    <field name="tcp.flags" showname="Flags: 0x002 (SYN)" size="2" pos="46" show="0x00000002" value="2" unmaskedvalue="a002">
      <field name="tcp.flags.res" showname="000. .... .... = Reserved: Not set" size="1" pos="46" show="0" value="0" unmaskedvalue="a0"/>
      <field name="tcp.flags.ns" showname="...0 .... .... = Nonce: Not set" size="1" pos="46" show="0" value="0" unmaskedvalue="a0"/>
      <field name="tcp.flags.cwr" showname=".... 0... .... = Congestion Window Reduced (CWR): Not set" size="1" pos="47" show="0" value="0" unmaskedvalue="02"/>
      <field name="tcp.flags.ecn" showname=".... .0.. .... = ECN-Echo: Not set" size="1" pos="47" show="0" value="0" unmaskedvalue="02"/>
      <field name="tcp.flags.urg" showname=".... ..0. .... = Urgent: Not set" size="1" pos="47" show="0" value="0" unmaskedvalue="02"/>
      <field name="tcp.flags.ack" showname=".... ...0 .... = Acknowledgment: Not set" size="1" pos="47" show="0" value="0" unmaskedvalue="02"/>
      <field name="tcp.flags.push" showname=".... .... 0... = Push: Not set" size="1" pos="47" show="0" value="0" unmaskedvalue="02"/>
      <field name="tcp.flags.reset" showname=".... .... .0.. = Reset: Not set" size="1" pos="47" show="0" value="0" unmaskedvalue="02"/>
      <field name="tcp.flags.syn" showname=".... .... ..1. = Syn: Set" size="1" pos="47" show="1" value="1" unmaskedvalue="02">
        <field name="_ws.expert" showname="Expert Info (Chat/Sequence): Connection establish request (SYN): server port 7777" size="0" pos="47">
          <field name="tcp.connection.syn" showname="Connection establish request (SYN): server port 7777" size="0" pos="0" show="" value=""/>
          <field name="_ws.expert.message" showname="Message: Connection establish request (SYN): server port 7777" hide="yes" size="0" pos="0" show="Connection establish request (SYN): server port 7777"/>
          <field name="_ws.expert.severity" showname="Severity level: Chat" size="0" pos="0" show="2097152"/>
          <field name="_ws.expert.group" showname="Group: Sequence" size="0" pos="0" show="33554432"/>
        </field>
      </field>
      <field name="tcp.flags.fin" showname=".... .... ...0 = Fin: Not set" size="1" pos="47" show="0" value="0" unmaskedvalue="02"/>
      <field name="tcp.flags.str" showname="TCP Flags: \xc2\xb7\xc2\xb7\xc2\xb7\xc2\xb7\xc2\xb7\xc2\xb7\xc2\xb7\xc2\xb7\xc2\xb7\xc2\xb7S\xc2\xb7" size="2" pos="46" show="\xc2\xb7\xc2\xb7\xc2\xb7\xc2\xb7\xc2\xb7\xc2\xb7\xc2\xb7\xc2\xb7\xc2\xb7\xc2\xb7S\xc2\xb7" value="a002"/>
    </field>
    <field name="tcp.window_size_value" showname="Window size value: 64240" size="2" pos="48" show="64240" value="faf0"/>
    <field name="tcp.window_size" showname="Calculated window size: 64240" size="2" pos="48" show="64240" value="faf0"/>
    <field name="tcp.checksum" showname="Checksum: 0x2330 [unverified]" size="2" pos="50" show="0x00002330" value="2330"/>
    <field name="tcp.checksum.status" showname="Checksum Status: Unverified" size="0" pos="50" show="2"/>
    <field name="tcp.urgent_pointer" showname="Urgent pointer: 0" size="2" pos="52" show="0" value="0000"/>
    <field name="tcp.options" showname="Options: (20 bytes), Maximum segment size, SACK permitted, Timestamps, No-Operation (NOP), Window scale" size="20" pos="54" show="02:04:05:b4:04:02:08:0a:19:76:01:5f:00:00:00:00:01:03:03:07" value="020405b40402080a1976015f0000000001030307">
      <field name="tcp.options.mss" showname="TCP Option - Maximum segment size: 1460 bytes" size="4" pos="54" show="02:04:05:b4" value="020405b4">
        <field name="tcp.option_kind" showname="Kind: Maximum Segment Size (2)" size="1" pos="54" show="2" value="02"/>
        <field name="tcp.option_len" showname="Length: 4" size="1" pos="55" show="4" value="04"/>
        <field name="tcp.options.mss_val" showname="MSS Value: 1460" size="2" pos="56" show="1460" value="05b4"/>
      </field>
      <field name="tcp.options.sack_perm" showname="TCP Option - SACK permitted" size="2" pos="58" show="04:02" value="0402">
        <field name="tcp.option_kind" showname="Kind: SACK Permitted (4)" size="1" pos="58" show="4" value="04"/>
        <field name="tcp.option_len" showname="Length: 2" size="1" pos="59" show="2" value="02"/>
      </field>
      <field name="tcp.options.timestamp" showname="TCP Option - Timestamps: TSval 427163999, TSecr 0" size="10" pos="60" show="08:0a:19:76:01:5f:00:00:00:00" value="080a1976015f00000000">
        <field name="tcp.option_kind" showname="Kind: Time Stamp Option (8)" size="1" pos="60" show="8" value="08"/>
        <field name="tcp.option_len" showname="Length: 10" size="1" pos="61" show="10" value="0a"/>
        <field name="tcp.options.timestamp.tsval" showname="Timestamp value: 427163999" size="4" pos="62" show="427163999" value="1976015f"/>
        <field name="tcp.options.timestamp.tsecr" showname="Timestamp echo reply: 0" size="4" pos="66" show="0" value="00000000"/>
      </field>
      <field name="tcp.options.nop" showname="TCP Option - No-Operation (NOP)" size="1" pos="70" show="01" value="01">
        <field name="tcp.option_kind" showname="Kind: No-Operation (1)" size="1" pos="70" show="1" value="01"/>
      </field>
      <field name="tcp.options.wscale" showname="TCP Option - Window scale: 7 (multiply by 128)" size="3" pos="71" show="03:03:07" value="030307">
        <field name="tcp.option_kind" showname="Kind: Window Scale (3)" size="1" pos="71" show="3" value="03"/>
        <field name="tcp.option_len" showname="Length: 3" size="1" pos="72" show="3" value="03"/>
        <field name="tcp.options.wscale.shift" showname="Shift count: 7" size="1" pos="73" show="7" value="07"/>
        <field name="tcp.options.wscale.multiplier" showname="Multiplier: 128" size="1" pos="73" show="128" value="07"/>
      </field>
    </field>
    <field name="" show="Timestamps" size="0" pos="34">
      <field name="tcp.time_relative" showname="Time since first frame in this TCP stream: 1.000813061 seconds" size="0" pos="34" show="1.000813061"/>
      <field name="tcp.time_delta" showname="Time since previous frame in this TCP stream: 1.000779336 seconds" size="0" pos="34" show="1.000779336"/>
    </field>
  </proto>
</packet>


<packet>
  <proto name="geninfo" pos="0" showname="General information" size="74">
    <field name="num" pos="0" show="5" showname="Number" value="5" size="74"/>
    <field name="len" pos="0" show="74" showname="Frame Length" value="4a" size="74"/>
    <field name="caplen" pos="0" show="74" showname="Captured Length" value="4a" size="74"/>
    <field name="timestamp" pos="0" show="May 24, 2023 20:26:19.111598122 CEST" showname="Captured Time" value="1684952779.111598122" size="74"/>
  </proto>
  <proto name="frame" showname="Frame 5: 74 bytes on wire (592 bits), 74 bytes captured (592 bits) on interface veth_nssf, id 0" size="74" pos="0">
    <field name="filtered" value="frame" />
  </proto>
  <proto name="eth" showname="Ethernet II, Src: 7a:24:b4:3d:64:76, Dst: da:73:09:fb:97:ae" size="14" pos="0">
    <field name="filtered" value="eth" />
  </proto>
  <proto name="ip" showname="Internet Protocol Version 4, Src: 10.0.9.1, Dst: 10.0.6.1" size="20" pos="14">
    <field name="filtered" value="ip" />
  </proto>
  <proto name="tcp" showname="Transmission Control Protocol, Src Port: 7777, Dst Port: 40740, Seq: 3606554706, Ack: 4090257149, Len: 0" size="40" pos="34">
    <field name="tcp.srcport" showname="Source Port: 7777" size="2" pos="34" show="7777" value="1e61"/>
    <field name="tcp.dstport" showname="Destination Port: 40740" size="2" pos="36" show="40740" value="9f24"/>
    <field name="tcp.port" showname="Source or Destination Port: 7777" hide="yes" size="2" pos="34" show="7777" value="1e61"/>
    <field name="tcp.port" showname="Source or Destination Port: 40740" hide="yes" size="2" pos="36" show="40740" value="9f24"/>
    <field name="tcp.stream" showname="Stream index: 0" size="0" pos="34" show="0"/>
    <field name="tcp.len" showname="TCP Segment Len: 0" size="1" pos="46" show="0" value="a0"/>
    <field name="tcp.seq" showname="Sequence number: 3606554706" size="4" pos="38" show="3606554706" value="d6f7a852"/>
    <field name="tcp.seq_raw" showname="Sequence number (raw): 3606554706" hide="yes" size="4" pos="38" show="3606554706" value="d6f7a852"/>
    <field name="tcp.nxtseq" showname="Next sequence number: 3606554707" size="0" pos="34" show="3606554707"/>
    <field name="tcp.ack" showname="Acknowledgment number: 4090257149" size="4" pos="42" show="4090257149" value="f3cc5efd"/>
    <field name="tcp.ack_raw" showname="Acknowledgment number (raw): 4090257149" hide="yes" size="4" pos="42" show="4090257149" value="f3cc5efd"/>
    <field name="tcp.hdr_len" showname="1010 .... = Header Length: 40 bytes (10)" size="1" pos="46" show="40" value="a0"/>
    <field name="tcp.flags" showname="Flags: 0x012 (SYN, ACK)" size="2" pos="46" show="0x00000012" value="12" unmaskedvalue="a012">
      <field name="tcp.flags.res" showname="000. .... .... = Reserved: Not set" size="1" pos="46" show="0" value="0" unmaskedvalue="a0"/>
      <field name="tcp.flags.ns" showname="...0 .... .... = Nonce: Not set" size="1" pos="46" show="0" value="0" unmaskedvalue="a0"/>
      <field name="tcp.flags.cwr" showname=".... 0... .... = Congestion Window Reduced (CWR): Not set" size="1" pos="47" show="0" value="0" unmaskedvalue="12"/>
      <field name="tcp.flags.ecn" showname=".... .0.. .... = ECN-Echo: Not set" size="1" pos="47" show="0" value="0" unmaskedvalue="12"/>
      <field name="tcp.flags.urg" showname=".... ..0. .... = Urgent: Not set" size="1" pos="47" show="0" value="0" unmaskedvalue="12"/>
      <field name="tcp.flags.ack" showname=".... ...1 .... = Acknowledgment: Set" size="1" pos="47" show="1" value="1" unmaskedvalue="12"/>
      <field name="tcp.flags.push" showname=".... .... 0... = Push: Not set" size="1" pos="47" show="0" value="0" unmaskedvalue="12"/>
      <field name="tcp.flags.reset" showname=".... .... .0.. = Reset: Not set" size="1" pos="47" show="0" value="0" unmaskedvalue="12"/>
      <field name="tcp.flags.syn" showname=".... .... ..1. = Syn: Set" size="1" pos="47" show="1" value="1" unmaskedvalue="12">
        <field name="_ws.expert" showname="Expert Info (Chat/Sequence): Connection establish acknowledge (SYN+ACK): server port 7777" size="0" pos="47">
          <field name="tcp.connection.sack" showname="Connection establish acknowledge (SYN+ACK): server port 7777" size="0" pos="0" show="" value=""/>
          <field name="_ws.expert.message" showname="Message: Connection establish acknowledge (SYN+ACK): server port 7777" hide="yes" size="0" pos="0" show="Connection establish acknowledge (SYN+ACK): server port 7777"/>
          <field name="_ws.expert.severity" showname="Severity level: Chat" size="0" pos="0" show="2097152"/>
          <field name="_ws.expert.group" showname="Group: Sequence" size="0" pos="0" show="33554432"/>
        </field>
      </field>
      <field name="tcp.flags.fin" showname=".... .... ...0 = Fin: Not set" size="1" pos="47" show="0" value="0" unmaskedvalue="12"/>
      <field name="tcp.flags.str" showname="TCP Flags: \xc2\xb7\xc2\xb7\xc2\xb7\xc2\xb7\xc2\xb7\xc2\xb7\xc2\xb7A\xc2\xb7\xc2\xb7S\xc2\xb7" size="2" pos="46" show="\xc2\xb7\xc2\xb7\xc2\xb7\xc2\xb7\xc2\xb7\xc2\xb7\xc2\xb7A\xc2\xb7\xc2\xb7S\xc2\xb7" value="a012"/>
    </field>
    <field name="tcp.window_size_value" showname="Window size value: 65160" size="2" pos="48" show="65160" value="fe88"/>
    <field name="tcp.window_size" showname="Calculated window size: 65160" size="2" pos="48" show="65160" value="fe88"/>
    <field name="tcp.checksum" showname="Checksum: 0x2330 [unverified]" size="2" pos="50" show="0x00002330" value="2330"/>
    <field name="tcp.checksum.status" showname="Checksum Status: Unverified" size="0" pos="50" show="2"/>
    <field name="tcp.urgent_pointer" showname="Urgent pointer: 0" size="2" pos="52" show="0" value="0000"/>
    <field name="tcp.options" showname="Options: (20 bytes), Maximum segment size, SACK permitted, Timestamps, No-Operation (NOP), Window scale" size="20" pos="54" show="02:04:05:b4:04:02:08:0a:ef:cd:99:a0:19:76:01:5f:01:03:03:07" value="020405b40402080aefcd99a01976015f01030307">
      <field name="tcp.options.mss" showname="TCP Option - Maximum segment size: 1460 bytes" size="4" pos="54" show="02:04:05:b4" value="020405b4">
        <field name="tcp.option_kind" showname="Kind: Maximum Segment Size (2)" size="1" pos="54" show="2" value="02"/>
        <field name="tcp.option_len" showname="Length: 4" size="1" pos="55" show="4" value="04"/>
        <field name="tcp.options.mss_val" showname="MSS Value: 1460" size="2" pos="56" show="1460" value="05b4"/>
      </field>
      <field name="tcp.options.sack_perm" showname="TCP Option - SACK permitted" size="2" pos="58" show="04:02" value="0402">
        <field name="tcp.option_kind" showname="Kind: SACK Permitted (4)" size="1" pos="58" show="4" value="04"/>
        <field name="tcp.option_len" showname="Length: 2" size="1" pos="59" show="2" value="02"/>
      </field>
      <field name="tcp.options.timestamp" showname="TCP Option - Timestamps: TSval 4023228832, TSecr 427163999" size="10" pos="60" show="08:0a:ef:cd:99:a0:19:76:01:5f" value="080aefcd99a01976015f">
        <field name="tcp.option_kind" showname="Kind: Time Stamp Option (8)" size="1" pos="60" show="8" value="08"/>
